ID,audio_path,num_samples,sample_rate,transcription,gender,lang_id,language,lang_group_id
1690,test/13542330409815692480.wav,314560,16000,we agree with the usoc's statement that the interests of our athletes and clubs and their sport may be better served by moving forward with meaningful change within our organization rather than decertification,0,19,English,0
1805,test/1361225517388701679.wav,184960,16000,scotturb bus 403 travels regularly to sintra stopping at cabo da roca,0,19,English,0
1853,test/13713355703439016228.wav,82560,16000,giancarlo fisichella lost control of his car and ended the race very soon after the start,1,19,English,0
1749,test/1372746700546513130.wav,219840,16000,it was ruled by the vichy french these were french people who had made peace with the germans in 1940 and worked with the invaders instead of fighting them,0,19,English,0
1928,test/13732033283623109766.wav,108480,16000,by 1976 thirty percent of machu picchu had been restored and restoration continues till today,1,19,English,0
1961,test/13809395828339499811.wav,225600,16000,one of the most common methods used to illustrate the importance of socialization is to draw upon the few unfortunate cases of children who were through neglect misfortune or wilful abuse not socialized by adults while they were growing up,1,19,English,0
2004,test/13824971935266428986.wav,111360,16000,the same month saw another airliner overrun a runway at mashhad and strike a wall killing seventeen,1,19,English,0
1666,test/13875708868701082683.wav,133440,16000,you may also wish to consult the advice of governments other than your own but their advice is designed for their citizens,1,19,English,0
1687,test/13888599635337906526.wav,184320,16000,segregation and recombination shuffle variation back and forth between the two pools with each generation,0,19,English,0
1773,test/13896470903695476292.wav,200000,16000,sleep interruption is the process of purposefully awakening during your normal sleep period and falling asleep a short time later 10–60 minutes,0,19,English,0
1970,test/1394697283561012104.wav,224960,16000,we don't know for sure but it may have had a forked tongue its diet included turtles large fish other mosasaurs and it may even have been a cannibal,0,19,English,0
1862,test/13963903782504043145.wav,161280,16000,nextgen is a system the faa claims would allow aircraft to fly shorter routes and save millions of gallons of fuel each year and cut carbon emissions,1,19,English,0
1903,test/14076834086577911298.wav,146880,16000,when all available resources are effectively used across the functional departments of an organization creativity and ingenuity can transpire,1,19,English,0
1695,test/14077379425479054842.wav,195840,16000,a simple popular dinner especially during the summer is the pa amb oli bread with olive oil tomato and any available condiments such as cheese tunafish etc,1,19,English,0
1921,test/14115239728007650784.wav,155520,16000,on the other hand icy and snowy conditions are normal in many countries and traffic goes on mostly uninterrupted all year round,1,19,English,0
1923,test/14139585382582687665.wav,245760,16000,the strategy proved effective cutting off vital military and civilian supplies although this blockade violated generally accepted international law codified by several international agreements of the past two centuries,1,19,English,0
2003,test/14146977097620621690.wav,110400,16000,to get the best views of hong kong leave the island and head for the kowloon waterfront opposite,1,19,English,0
1694,test/14160468372285024125.wav,171520,16000,children are placed in foster care for a wide variety of reasons that range from neglect to abuse and even to extortion,0,19,English,0
1823,test/14210445503617137582.wav,122880,16000,traffic flow is the study of the movement of individual drivers and vehicles between two points and the interactions they make with one another,1,19,English,0
1822,test/14212778709566873555.wav,184320,16000,the moroccan sultan rebuilt the city as daru l-badya and it was given the name casablanca by spanish traders who established trading bases there,1,19,English,0
1943,test/14240553912561192306.wav,166400,16000,the lower the tension the more positive the life force present every person has the potential to find absolute peace and contentment,0,19,English,0
1956,test/14278251866048014426.wav,121920,16000,using ships to transport goods is by far the most efficient way to move large amounts of people and goods across oceans,1,19,English,0
1719,test/14291047344508554279.wav,172800,16000,severe weather is the generic term for any dangerous weather phenomenon with the potential to cause damage serious social disruption or loss of human life,1,19,English,0
1689,test/14328568808003469713.wav,332160,16000,europe is a continent that is relatively small but with many independent countries under normal circumstances travelling through multiple countries would mean having to go through visa applications and passport control multiple times,0,19,English,0
1810,test/14328961705663130128.wav,181440,16000,california governor arnold schwarzenegger signed into law a bill that bans the sale or rental of violent video games to minors,1,19,English,0
1778,test/14337122471415370884.wav,61440,16000,television reports show white smoke coming from the plant,1,19,English,0
2006,test/14384731673566706407.wav,99840,16000,elements like calcium and potassium are considered metals of course there are also metals like silver and gold,1,19,English,0
1805,test/14396239747345303015.wav,90240,16000,scotturb bus 403 travels regularly to sintra stopping at cabo da roca,1,19,English,0
1890,test/14472713183013529731.wav,115200,16000,most modern research telescopes are enormous facilities in remote areas with favorable atmospheric conditions,1,19,English,0
1782,test/1447510838326873839.wav,189120,16000,also between each dynasty was an unstable age of divided provinces the best-known of these periods was the three kingdoms epoch taking place for 60 years between the han and the jin dynasty,1,19,English,0
1784,test/14572481585322233862.wav,304320,16000,greenland was settled sparsely in the norse sagas they say that erik the red was exiled from iceland for murder and when travelling further west found greenland and named it greenland,0,19,English,0
1949,test/14585898865749103727.wav,103680,16000,the term bug is used by entomologists in a formal sense for this group of insects,1,19,English,0
1683,test/14624695685248966546.wav,177600,16000,there are still many men and women alive who survived their time here and many more who had loved ones who were murdered or worked to death there jews and non-jews alike,1,19,English,0
1919,test/14643126700888487830.wav,166080,16000,the city is also the base to climb the nyiragongo volcano along with some of the cheapest mountain gorilla tracking in africa,1,19,English,0
1791,test/14648010410081654131.wav,72000,16000,do not deface the site by marking or scratching graffiti into structures,1,19,English,0
1693,test/14681158725429032808.wav,136320,16000,but after losing the captain's wicket india only made 36 runs loosing 7 wickets to end the innings,1,19,English,0
1885,test/14693330690944350091.wav,143040,16000,between 10:00-11:00 pm mdt a fire was started by the inmates in the yard,1,19,English,0
1772,test/14704091860070528032.wav,93760,16000,so it is likely that the notation was added simply as a label,0,19,English,0
1998,test/14738234113419638776.wav,105600,16000,they have feet with scales and claws they lay eggs and they walk on their two back legs like a t-rex,1,19,English,0
1857,test/14805661830607478688.wav,195520,16000,he added that they should not however be asked to take on obligations that go beyond their development stage responsibility and capabilities,0,19,English,0
1761,test/14836289886440749215.wav,137920,16000,the photographers later took the place of an aged lady as she needed the lavatory mendoza was gunned down,0,19,English,0
1702,test/1483818313790875806.wav,162880,16000,in just two weeks the americans and free french forces had liberated southern france and were turning towards germany,0,19,English,0
1746,test/14855926442890309286.wav,127040,16000,plants make their food from the sun by photosynthesis they also provide shade,0,19,English,0
1907,test/14868402834603110105.wav,87360,16000,soon after the outbreak of hostilities britain initiated a naval blockade of germany,1,19,English,0
1769,test/14944400645209157789.wav,135360,16000,built by the egyptians in the third century bce the great pyramid is one of many large pyramid structures built to honor dead pharaoh,1,19,English,0
1788,test/14960809846091330730.wav,249600,16000,usa gymnastics supports the united states olympic committee's letter and accepts the absolute need of the olympic family to promote a safe environment for all of our athletes,0,19,English,0
1801,test/1497068838470674354.wav,209600,16000,the parade of buildings that make the hong kong skyline has been likened to a glittering bar chart that is made apparent by the presence of the waters of victoria harbour,0,19,English,0
1861,test/14982964006464846866.wav,168960,16000,as a result the performers smoke cannabis joints on stage and the theatre itself is encouraging the audience to join in,0,19,English,0
1996,test/14993919225529607964.wav,249600,16000,australia's mitchell gourley finished eleventh in the men's standing super-g czech competitor oldrich jelinek finished sixteenth in the men's sitting super-g,0,19,English,0
1697,test/15004506730396162914.wav,101760,16000,he has been unable to take the drugs needed to overcome his pain as they are banned from the games,1,19,English,0
1962,test/15038927295183526116.wav,105600,16000,the ph level is indicated by the amount of hydrogen the h in ph ions in the tested chemical,1,19,English,0
1847,test/15094027080386890060.wav,186240,16000,he was greeted by singapore's deputy prime minister wong kan seng and discussed trade and terrorism issues with the singapore prime minister lee hsien loong,1,19,English,0
1932,test/15167791612734877902.wav,302400,16000,five minutes into the display a wind starts rolling in about a minute later the wind is reaching 70km/h... then the rain comes but so hard and so large that it slaps your skin like a needle then hail fell from the sky people panicking and screaming and running over each other,1,19,English,0
1850,test/15199695878621076767.wav,287680,16000,this will allow it to be backwards compatible with 802.11a 802.11b and 802.11g provided that the base station has dual radios,0,19,English,0
1700,test/15228527404193944906.wav,115200,16000,it is thinner under the maria and thicker under the highlands,0,19,English,0
1727,test/15257026998252037010.wav,104640,16000,feral children may have experienced severe child abuse or trauma before being abandoned or running away,1,19,English,0
1984,test/15278922555301201869.wav,179520,16000,mass car ownership also leads to a higher incidence of accidents on the roads which leads to the invention of new techniques in healthcare for repairing damaged bodies,1,19,English,0
1853,test/1531123292382678510.wav,92160,16000,giancarlo fisichella lost control of his car and ended the race very soon after the start,1,19,English,0
1694,test/15359249341091182172.wav,127680,16000,children are placed in foster care for a wide variety of reasons that range from neglect to abuse and even to extortion,1,19,English,0
1878,test/15462197415062072209.wav,147840,16000,the central authority of the church had been in rome for over a thousand years and this concentration of power and money led many to question whether this tenet was being met,1,19,English,0
1692,test/15494714124475485422.wav,118080,16000,according to japan's nuclear agency radioactive caesium and iodine has been identified at the plant,1,19,English,0
1797,test/15505806025419963341.wav,116160,16000,everyone participates in society and uses transportation systems almost everyone complains about transportation systems,1,19,English,0
1912,test/15510957858467012907.wav,168320,16000,most of the smaller islands are independent nations or associated with france and known as luxury beach resorts,0,19,English,0
1711,test/15533201887617185536.wav,157440,16000,these theories look at what it is about certain people that make them want the things that they do and what things in their environment will make them do or not do certain things,1,19,English,0
1913,test/1553627708563736436.wav,140160,16000,the tiger's roar is not like the full-voiced roar of a lion but more like a sentence of snarly shouted words,1,19,English,0
1787,test/1559267283424963143.wav,153600,16000,blogging is a tool that inspires collaboration and encourages students to extend learning well beyond the traditional school day,0,19,English,0
1977,test/15592925372393530543.wav,108480,16000,prides are made up of one to three related adult males along with as many as thirty females and cubs,1,19,English,0
1667,test/156130586016414879.wav,173760,16000,generally speaking two behaviors can emerge as managers begin to lead their former peers. one end of the spectrum is trying to remain  one of the guys” or gals,1,19,English,0
1669,test/15618717836108767541.wav,115200,16000,police superintendent chandra shekhar solanki said the accused appeared in court with covered faces,1,19,English,0
1838,test/15622589675144910207.wav,96960,16000,the great pyramid at giza is the only one of the seven wonders that is still standing today,1,19,English,0
1832,test/15648812079343683412.wav,148800,16000,popular sports include football basketball volleyball water-polo fencing rugby cycling ice hockey roller hockey and f1 motor racing,1,19,English,0
1991,test/15667010054869079797.wav,155840,16000,during this period of european history the catholic church which had become rich and powerful came under scrutiny,0,19,English,0
1776,test/15695900311829620190.wav,131520,16000,through the night between 150 and 200 copies were made now known as dunlap broadsides,1,19,English,0
1809,test/15738179776336088720.wav,171840,16000,crossties were introduced fairly early to hold the tracks in place gradually however it was realised that tracks would be more efficient if they had a stip of iron on the top,1,19,English,0
1693,test/15739600005438498912.wav,106560,16000,but after losing the captain's wicket india only made 36 runs loosing 7 wickets to end the innings,1,19,English,0
1878,test/15790784892019701649.wav,209920,16000,the central authority of the church had been in rome for over a thousand years and this concentration of power and money led many to question whether this tenet was being met,0,19,English,0
1730,test/15820671163473629623.wav,193920,16000,buses depart the inter-district bus station across the river throughout the day though most especially those heading to the east and jakar/bumthang leave between 06:30 and 07:30,1,19,English,0
1696,test/15824575839049156888.wav,119040,16000,the two compounds react with one another to form crystals that may block kidney function researchers at the university said,1,19,English,0
1695,test/15842229443202938478.wav,159360,16000,a simple popular dinner especially during the summer is the pa amb oli bread with olive oil tomato and any available condiments such as cheese tunafish etc,1,19,English,0
1739,test/15935462347202880059.wav,162240,16000,resting on the top of one of the mountains north of mecca the cave is completely isolated from the rest of the world,1,19,English,0
1758,test/15945599843667387523.wav,199680,16000,the archipelago lies 120 km north of the peninsula the largest is king george island with the settlement of villa las estrellas,0,19,English,0
1699,test/1596269393232229615.wav,153600,16000,bishkek was described as sinking into a state of anarchy by one observer as gangs of people roamed the streets and plundered stores of consumer goods,1,19,English,0
1842,test/15966297335082605286.wav,207360,16000,because the dinosaur feathers do not have a well-developed shaft called a rachis but do have other features of feathers barbs and barbules the researchers inferred the rachis was likely a later evolutionary development that these other features,1,19,English,0
1836,test/16010170383637871536.wav,172800,16000,people have known about basic chemical elements such as gold silver and copper from antiquity as these can all be discovered in nature in native form and are relatively simple to mine with primitive tools,1,19,English,0
1975,test/1605300975319497622.wav,156160,16000,vatican city's population is around 800 it is the smallest independent country in the world and the country with the lowest population,0,19,English,0
1738,test/1616366247253366320.wav,145920,16000,it also attacked anything that entered the water even a giant dinosaur such as t rex would be no match for it,1,19,English,0
1935,test/1618638950277648344.wav,160320,16000,however that is not true although there is something written on the back of the document it is not a treasure map,0,19,English,0
1889,test/16188741492070958424.wav,108480,16000,it has brought us the train the car and many other transportation devices,0,19,English,0
1865,test/16200495359369533302.wav,120000,16000,saint petersburg cruises include time in town. cruise passengers are exempted from visa requirements check the terms,1,19,English,0
1848,test/16207777688923954070.wav,160320,16000,a car bomb detonated at police headquarters in gaziantep turkey yesterday morning killed two police officers and injured more than twenty other people,1,19,English,0
1838,test/16234809612157196531.wav,113280,16000,the great pyramid at giza is the only one of the seven wonders that is still standing today,1,19,English,0
1718,test/16249020005264010985.wav,188800,16000,there is no universal definition for which manufactured items are antiques some tax agencies define goods older than 100 years as antiques,0,19,English,0
1828,test/16311865697463361030.wav,115200,16000,a search of the internet for hostile environment course' will probably provide the address of a local company,1,19,English,0
1740,test/16327101627424867030.wav,112320,16000,the pyramid sound and light show is one of the most interesting things in the area for kids,0,19,English,0
1701,test/163369145011818208.wav,110400,16000,"goats seem to have been first domesticated roughly 10,000 years ago in the zagros mountains of iran",1,19,English,0
1721,test/1633905380187706594.wav,147840,16000,after the dam was built in 1963 the seasonal floods that would spread sediment throughout the river were halted,0,19,English,0
1699,test/16355757648693617724.wav,126720,16000,bishkek was described as sinking into a state of anarchy by one observer as gangs of people roamed the streets and plundered stores of consumer goods,1,19,English,0
1854,test/16367441259442214277.wav,137280,16000,the vehicle itself was taken away from the scene of the accident at approximately 1200 gmt on the same day,0,19,English,0
1896,test/16437430878550556483.wav,182400,16000,usa gymnastics and the usoc have the same goal making the sport of gymnastics and others as safe as possible for athletes to follow their dreams in a safe positive and empowered environment,1,19,English,0
1746,test/16482413846901462656.wav,144960,16000,plants make their food from the sun by photosynthesis they also provide shade,0,19,English,0
1796,test/16528325964292062857.wav,179520,16000,this sediment was necessary for creating sandbars and beaches which served as wildlife habitats,0,19,English,0
1843,test/16545276994853978309.wav,168000,16000,professor pamela ferguson of the university of dundee notes journalists do seem to be walking a dangerous line if publishing photos etc of suspects,1,19,English,0
1683,test/16561255522246307224.wav,283200,16000,there are still many men and women alive who survived their time here and many more who had loved ones who were murdered or worked to death there jews and non-jews alike,0,19,English,0
1764,test/16631812927540811343.wav,154560,16000,the number of people present was so large that it was not possible for everybody to gain access to the funeral in st peter's square,1,19,English,0
1904,test/16685618834972658685.wav,169280,16000,however due to the slow communication channels styles in the west could lag behind by 25 to 30 year,0,19,English,0
1698,test/16702780028313283623.wav,120320,16000,everything in the universe is made of matter all matter is made of tiny particles called atoms,0,19,English,0
1851,test/16721823661104667622.wav,102720,16000,rip currents are the returning flow from waves breaking off the beach often at a reef or similar,1,19,English,0
1700,test/16725549094651424150.wav,78720,16000,it is thinner under the maria and thicker under the highlands,1,19,English,0
1907,test/16757205419144758552.wav,112320,16000,soon after the outbreak of hostilities britain initiated a naval blockade of germany,0,19,English,0
1813,test/16766787285057438836.wav,179520,16000,barcelona's official languages are catalan and spanish about a half prefer to speak catalan a vast majority understands it and virtually everyone knows spanish,1,19,English,0
1996,test/16824485789160047135.wav,223680,16000,australia's mitchell gourley finished eleventh in the men's standing super-g czech competitor oldrich jelinek finished sixteenth in the men's sitting super-g,1,19,English,0
1915,test/16847628585853049714.wav,213440,16000,you can use boda-boda motorcycle taxi to get around goma. the normal local price is ~500 congolese francs for the short ride,0,19,English,0
1721,test/16851035292487940942.wav,103680,16000,after the dam was built in 1963 the seasonal floods that would spread sediment throughout the river were halted,1,19,English,0
1910,test/16890607023935231060.wav,120640,16000,parisians have a reputation for being egocentric rude and arrogant,0,19,English,0
1954,test/16989675193715509568.wav,125760,16000,their disciplined defence ball handling skills and excellent team work made them stand out and it was clear that this was the team to beat,1,19,English,0
1993,test/1701461929359257439.wav,138560,16000,the tenth named storm of the atlantic hurricane season subtropical storm jerry formed in the atlantic ocean today,0,19,English,0
1981,test/17029455052229515619.wav,148160,16000,if you only go ashore using shipboard excursions you will not need a separate visa as of 2009,0,19,English,0
1967,test/17087438879836851456.wav,155520,16000,layton had asked for changes to the conservatives' environmental bill during the meeting with the pm asking for a thorough and complete rewriting of the conservative party's environmental bill,1,19,English,0
1837,test/17107523751051309601.wav,128640,16000,liberal criticism of the reconstruction effort has focused on the awarding of reconstruction contracts to perceived washington insiders,1,19,English,0
2009,test/17120997777600226051.wav,221760,16000,the most readily accessible plant resources would have been the proteins accessible in leaves and legumes but these are hard for primates like us to digest unless they are cooked,0,19,English,0
1964,test/17158526797037461547.wav,157440,16000,the 25 dunlap broadsides still known to exist are the oldest surviving copies of the document the original handwritten copy has not survived,1,19,English,0
1933,test/17202654907652316758.wav,138240,16000,finally there are many small cats including loose pet cats that eat the far more numerous small prey like insects rodents lizards and birds,1,19,English,0
1877,test/1722118868151836971.wav,312960,16000,current senator and argentine first lady cristina fernandez de kirchner announced her presidential candidacy yesterday evening in la plata a city 50 kilometers 31 miles away from buenos aires,0,19,English,0
1944,test/1724953769276277810.wav,168000,16000,these are sometimes-crowded family beaches with a good range of shops lining the shore swimming is safe,1,19,English,0
1731,test/17257800930548614745.wav,119680,16000,in the archipelagos and lakes you do not necessarily need a yacht,0,19,English,0
1835,test/1727490782035998315.wav,190080,16000,no tsunami warning has been issued and according to the jakarta geophysics agency no tsunami warning will be issued because the quake did not meet the magnitude 6.5 requirement,1,19,English,0
1817,test/17289442889985927678.wav,108800,16000,the schengen zone however works somewhat like one country in this respect,0,19,English,0
1773,test/1729210846741769405.wav,204480,16000,sleep interruption is the process of purposefully awakening during your normal sleep period and falling asleep a short time later 10–60 minutes,0,19,English,0
1677,test/1731561740051730459.wav,95040,16000,today the only insects that cannot fold back their wings are dragon flies and mayflies,1,19,English,0
1926,test/17382227205265930996.wav,107520,16000,accepted were aristotle's views on all matters of science including psychology,1,19,English,0
1978,test/17390731724222522492.wav,64320,16000,for the springboks it ended a five-match losing streak,1,19,English,0
1938,test/17392214165625498386.wav,168960,16000,the hospital has followed protocol for infection control including separating the patient from others to prevent possible infection of others,0,19,English,0
1854,test/17406400587485166719.wav,122880,16000,the vehicle itself was taken away from the scene of the accident at approximately 1200 gmt on the same day,0,19,English,0
1873,test/17476880836582943567.wav,175680,16000,be firm in turning down men and don't be afraid to stand your ground cultural differences or not it doesn't make it ok!,0,19,English,0
1775,test/17477520783262554049.wav,184640,16000,the use of video recording has led to important discoveries in the interpretation of micro-expressions facial movements which last a few milliseconds,0,19,English,0
